listing_id,id,date,reviewer_id,reviewer_name,comments
11399407,63987309,2016-02-28,2311446,Matthew,"I felt very at home with Tat immediately as he was very knowledgable, friendly, helpful and welcoming. Tat patiently answered our questions as a local and showed us how to get around and where to go. What a great experience!! His home were as  the pictures, clean, comfortable and convenient. Surrey Hills was such a beautiful, conveniently located heritage area. I highly recommend Tat place. It is hard to beat for convenient location, great host and nice beautiful heritage area."
11399407,64943430,2016-03-09,13329247,Ashok,"Tat was extremely helpful before my arrival and then very hospitable and friendly while I was there. The room was lovely and the bathroom was great. The house overall is extremely well done having been recently renovated - so it made the stay very very easy. The location was great for what I wanted so I could go off and do things during the day, return for a rest and then go out for the evening - and it was within walking distance of everywhere I wanted to go which made it fantastic. This was a wonderful stay and I would thoroughly recommend it to anyone else :-)"
11399407,65108561,2016-03-10,54553132,Yang,"The accommodation is clean, comfortable and the city centre is really close. Tat is a very friendly person, he provided so much information about Sydney, and it helped me a lot. I can really recommend this place!"
11399407,65255615,2016-03-12,255359,Gretha,This was my second stay at Tat's place and it was truly a 'coming home' experience. Tat is a very welcoming host! The house is completely new after the fabulous renovation. I will most definitely book again.
11399407,66521300,2016-03-23,39245983,Vance,"The place is wonderful, clean and in a very nice quiet surrounding and yet nearby to Central station. Tat have been a great host. We feel comfortable, relax and easy. Definitely a great place to stay in Sydney. Thanks for everything Tat!"
11399407,67603989,2016-03-30,27810353,美媛,"房东人好好,来的第一个网上就帮我解决了虎航定不了行李的大问题,我当时好着急啊~房东很贴心自己打印了地图。 从他家到唐人街走路就去了, 还帮我们洗衣服凉衣服。感动啊~"
11399407,69032242,2016-04-08,12943613,Emma,I have the most wonderful Airbnb experience on my resent stay in Tats home. Tat is a very house proud host & ever so welcoming. The room was very comfortable & clean. I have recommended Tat's accommodation highly & will definitely book to stay again when I am next in Sydney.
11399407,69477743,2016-04-11,51710654,Sharon,"My husband and I had a great time at Tat's place. Not only the place itself is easily accessible to the Central train station, it is also very modern and well-equipped. Tat has been very helpful and very responsive to all our questions. We enjoyed chatting with Tat to know more about the local lifestyle in Sydney! Highly recommend this place!"
11399407,70037262,2016-04-15,54714006,Kristel,My stay at Tat's place was great. The neighbours were a bit loud but that wasnt a big deal. The house itself is lovely and lovingly renovated so everything was very clean and well looked after so it was a very comfortable place to stay. Would definitely recommend and stay again myself (I didn't really want to leave!)
11399407,70671338,2016-04-19,60704478,Yan Bin,"The location is about an 8 min walk to central stn. And it was also walking distance to crown street where many of the good cafes are located. Room was clean and tidy and when we went, Tat was not around but he had 2 friends to help us with everything. :) definitely recommend this place!"
11399407,71018559,2016-04-22,26022705,Luciana,"I had a really good time at Tat's place. The location is just perfect as I was in the Sydney CBD for interviews. It took me 30 minutes to walk to my interview locations or just a few minutes by train from Tat's place. 
The house is beautifully decorated, including my room and bathroom. I slept really well as the place is extremely silent in the evenings. I am happy as I passed on the interviews :) and I look forward to stay there again once I go for my apartment hunting in Sydney in the next month. Thanks Tat for providing such a beautiful, peaceful and well located place which made me relax and succeed :)"
11399407,71662138,2016-04-27,1311297,Muna,"I throughly loved my stay here. The house was bright and cheerful,  and conveniently located, and my room was comfortable and spotlessly clean. I really felt at home here. Tat is a terrific host deserving of his Super Host status. He really does thinks of everything. He wasn't here when I arrived but his friends were. When I did meet Tat I found him to be warm, friendly and incredibly helpful. He had maps, guidebooks, lots of great suggestions and even lent me his Opal card for getting around. The neighbourhood is a brilliant place to be in, with lots of fabulous cafes and restaurants, supermarkets and convenience stores and just a few minutes walk from the train station and bus stops. Getting to the key sights was a cinch. I'd highly recommend a stay here and would love to come back."
11399407,73274908,2016-05-07,41606656,Marit,"Very warm welcome by Tat with explanation of what to do and see around Sydney. Clean, recently renovated home with all facilities you need for a comfortable stay. Location is convenient, close to Central station and the hip streets of Surry Hills. Everything you could wish for during your stay! Minor inconvenience has been a little noise from a neighbors' party during one night."
11399407,73770454,2016-05-10,34101188,Victor,Tat is a great host. I am definitely going to stay at Tat's place if I visit Sydney again. Tat was very helpful and showed us how to travel around the city. The location is excellent and is very close to Central station. The room is very clean and comfortable.
11399407,77985126,2016-06-04,26022705,Luciana,"This was the second time I stayed in Tat's place and every time is better. I am looking forward to staying there for the third time soon. 
Tat is very friendly and excels in making his guests feeling welcome! He went out of his way to help me as I was looking to rent a property in Sydney. He gave me a lift and great hints on the rental market. In addition, his place is always so clean, beautifully decorated, quiet and in a very good location. 
Staying there proved the spirit of Airbnb that ""A stranger is just a friend I haven't met yet""!"
11399407,79281968,2016-06-12,29103495,Laurie,Tat was a perfect host. He was very helpful and showed us how to travel around the city. The room was exactly what we looking for.we could not recommend any higher.thanks for muffin and for all!
11399407,81548666,2016-06-23,54168599,Hayato,"Tat is a fantastic (Super)host who knows all the best spots in Sydney.
This terrace is newly renovated and in a great location - minutes from cafés, restaurants, shops and public transport.
Thanks for making my first Airbnb experience memorable!"
11399407,82623453,2016-06-28,11834205,Lynda,"Fabulous stay with a host that was extremely helpful and welcoming! Well organised and informative and the apartment was as advertised- very clean and inviting. Great location and would highly recommend!
"
11399407,83905216,2016-07-04,11052817,Laura,"Tat is an amazing host, super friendly, approachable, and helpful. His place is a gem! It looks better than the photo, very clean and comfortable. The neighborhood was beautiful and the location was perfect! We had a wonderful stay with Tat. I'd recommend it to all who are visiting Sydney!"
11399407,84409592,2016-07-07,40764163,Cammy,"The host tat is very nice. He introduced the places near by the house and the public transport. Train station is just walking distance. The house and room is tidy, new and clean. Everything is in order in the house. Tat welcomed us to use it anytime. I had a great stay in Sydney."
11399407,84952361,2016-07-09,63693835,Ying,"房东人非常好,因为我们的飞机晚点两小时,房东依然耐心在家等待我们。房子非常漂亮,与照片相符。最棒的是房子的地理优势,去哪都很方便。"
11399407,86856626,2016-07-17,33327303,Na,"Tat是非常棒的房东,和蔼可亲,给了我们很多游玩的建议,还特意自制了非常实用的地图给我们做讲解。他的房子非常的漂亮干净,和提供的图片是一样的,让我们像住在家里一样舒心,我们八岁的儿子也喜欢上了这个漂亮的家。这是一次非常棒的旅行!下次再有机会去悉尼我们还会选择Tat的家。"
11399407,88309014,2016-07-24,75666129,Pei Si,"Felt welcome by Tat, he introduced us to alot of nice places to shop and eat in sydney.
Enjoy my stay at his house during my stay.
"
11399407,88931925,2016-07-26,28409702,N,"Sehr komfortable, saubere Unterkunft in guter Lage. Wir würden immer wieder dort übernachten."
11399407,90232354,2016-07-31,22017712,Katharina,Tat is a welcoming host providing city maps and tips about whag to do in sydney if you are a tourist. The room and the common areas are kept very clean and the kitchen is well furnished. I felt really comfortable throughout my stay there and could always appraoch Tat if I had any issues or questionsx
11399407,92849132,2016-08-10,24271492,YeRim,"I loved staying at Tat's place. To begin with, he was eager to help you at all times and very friendly. Also, his place was impeccably clean and modern. The bed and beddigs were perfect and soft, so even though it was kinda chilly in the morning and the night, I didn't feel any cold. The location was also nice. It was close to bus stations. You could reach the station in 7 minutes. I would love to stay Tat's place again."
11399407,96622628,2016-08-23,45647395,Kenny,"Tat was very helpful, friendly and efficient.  He gave us plenty of information that helped facilitate our entire stay in Sydney.  The room was cosy, clean and had good heating that kept us warm during the winter period.  Thank you for hosting us, Tat, and we would love to stay at your place again."
11399407,97258665,2016-08-26,87699426,Cattleya,Me and my husband loved our stay here. Tat's place is really neat and beautiful. He was the perfect host and told us a lot about good places to eat and how to get around the city. I wouldnt look for any place else when going to sydney.
11399407,98653739,2016-09-01,35407894,Marie Caroline,"Tat is a very good host!
He gived us a lot of advices and was always available and friendly!
The room and the bathromm were consistent cosy and modern!"
11399407,102735575,2016-09-19,28085287,Rishin,"Tat was a very welcoming host, making sure everything was smooth and sorted. The house is beautiful, and very much a home from home for those travelling."
11399407,104293972,2016-09-26,80584742,Eric,"Tat人很好,像个大哥哥,告诉你所有你想知道的。房子位置也很好,住的很舒服!太赞了!"
11399407,104489770,2016-09-26,47295939,Vicky,"It's a beautiful & clear house, closing to city. My cousin live there two nights and she love it. Tat is a friendly host as well."
11399407,105411351,2016-10-01,81436361,Yingnan,"Tat was so nice, the room was very clean and comfortable. We had a wonderful time in Tat's house."
11399407,107566243,2016-10-11,91049317,Min,"离开central station步行大概15分钟以内,出行方便,交通便利。周边有2家大型的 超市可以购买日常所需。房间干净整洁,很可惜,由于房东不在澳洲没有遇到。"
11399407,108152971,2016-10-14,94324696,Carrie,"这次是度蜜月来到澳洲旅行,最后一站选择悉尼,在Tat的家待了四天三晚。Tat的朋友Philip帮助我们check in,介绍悉尼好玩的地方给我们。最后离开的那一天在house煮了一顿中国午餐并和一位房客Nicoh一起吃,他还很热心的帮我们倒垃圾和收拾房间。我们订的房间带有独立卫浴,床是1.5米。"
11399407,109035972,2016-10-18,6728171,Adorra,"Tat's place is beautiful! Even though Tat wasn't in, checking in was a breeze and efficient. His friend who received us at home was very helpful giving us directions to the nearest Coles and eateries. We had the room with the ensuite and it was definitely one of the best rooms to have. The toilet and room was clean. Scratch that, the entire house is clean and in excellent order. We had a good stay at Tat's. Location is a good and well surrounded with nice restaurants and etc. Highly recommended to stay at Tat's!"
11399407,110227627,2016-10-24,89502957,Faye,"Unfortunately we did not get to meet Tat throughout our stay but he was still incredibly helpful and informative and always quick to respond with any queries you may have. 

Tat was very knowledgable about the area,giving us great advice in terms of transportation and things to do in Sydney. We were originally meant to be staying in a double room but was swapped for the Studio at no extra charge which was a great surprise to us as we then had our very own private living area. The studio was small but perfect for couples,modern and bright and impeccably clean. Everything you need is there including toiletries and towels,you can also do your washing which is convenient for anyone travelling onwards to another destination. 

The studio is a five minute walk to Central station which is extremely easy to use and gets you into the main city centre in no time at all. Surrey Hills is obviously more of a surburban area as some parts can be a little 'rough round the edges' but nonetheless it felt safe and we had no further issues. 

This was our first time in Sydney and using Air BnB and overall it was an excellent experience. We would happily use Tat and the studio again, we'd like to thank him for hosting us and making our holiday stress free and extremely comfortable. 

Faye & Chris"
11399407,111019811,2016-10-29,96438183,John,Had a great stay at Tat home. Nice bedroom with toilet and bath room. Great dinning room share with flatmate. Tat was on the trip and Nicco helps to settle down and he is helpful.
11399407,111800566,2016-11-01,19411730,Euphony,Excellent experience in Tat's place! It's clean and comfortable. He was so friendly and helpful when we stayed 3 nights there. The position was convenient to go everywhere in Sydney. Recommand definitely!
11399407,112643145,2016-11-06,23917978,Mark,"Nice place, Surry hills always a great location. Tat is great guy as well. Two thumbs up."
11399407,112922473,2016-11-08,36836637,黎明,"在Tat家住了5天,为了花掉Airbnb送的券,拆分成了两个订单,2天和3天:)  Airbnb允许这样操作的。

Tat见到我直接退给了我第一单的清洁费噢,超贴心。

对他的评价我写在另一个订单后面了,有兴趣可以查阅。超级推荐Tat家!32个赞!"
11399407,113283792,2016-11-11,36836637,黎明,"感谢Tat提供的住宿,强烈推荐大家入住Tat家:
1.位置绝佳,距离CBD走路10分钟,在悉尼玩了五天,每天起来散散步就走到市中心了。房子在Surryhill的保留区,闹中有静,距离Coles超市和药房走路5分钟,给国内亲戚带东西直接拎回来就好了。
2.房间干净整洁,床很舒服,独立的卫生间,洗澡很方便。厨房里的设施也很齐全。
3.Tat可以讲流利的汉语,这对于我这种英语不好的人来说简直太幸福了。和他聊天超级有意思。
4.Tat随时都准备好给我提供需要的帮助,我是去考试的,忘记打准考证,Tat上楼两分钟就给我打好了,还是彩色的噢:)    临行前下午,我担心走的太早打不到车,Tat还帮叫了Uber。
总之超级推荐啦,Tat是个非常有趣而且有魅力的家伙,希望下次去悉尼还可以住Tat家~~"
11399407,114120557,2016-11-15,36245898,Laura,"Tat couldn't have been a better host, extremely responsive communication and helpful. The place was emaculate, room and private bathroom were exactly as describe. Great location, a short walk to central station."
11399407,114968262,2016-11-20,90573827,Roland,Formidable place and an even more tremendous host. Thank you for a unique experience.
11399407,115102097,2016-11-21,101489817,Julie,NA
11399407,115335794,2016-11-23,13585485,Warren,"Tat's guest room was clean and comfortable with a private bath.  Wifi and a TV in the room was a plus.  Tat was very personable and made us feel welcome and he was very helpful with all the local tips.  If we had a chance to stay longer, we would have liked to interact with him more."
11399407,116087561,2016-11-27,24828144,John,Very clean and tidy with good wifi. Ideal position close to restaurants and public transport.
11399407,116358469,2016-11-29,7374353,Rayid,"I had a wonderful stay at Tat's place. This was my second time there and I loved it. The location is great, close to transportation and walking distance from coffee shops, restaurants, and the central station. The house is exactly as described -  clean and comfortable. Tat's a great host, very helpful and accommodating. I'll definitely stay there again next time I'm in sydney!"
11399407,116692343,2016-12-02,98164143,Clairexin,"Tat is a very hospitable and friendly host. He gave us a very warm welcome upon reaching his house. He gave detail orientation, provide maps to us and also recommend us lots of food suggestions (those that often visited by locals and not just tourists :D). He also borrowed us the opal Travelling card. 

The location is convenient. Walkable distance to lots of nice Chinese restaurant, famous cafe like bourke street bakery, Devon cafe.

The entire house is very clean (especially the toilet) and trendy. We felt very relax and free when staying at his house.  

On the last day when we forgot to return the room key to Tat, he offer to make his way to get keys from us instead of asking us to go back. He is indeed a very helpful host. 

I will highly recommend Tat's house to anyone that is going to Sydney. Definitely will stay back his house again! ☺️"
11399407,117249099,2016-12-05,67822533,Emilie,"Whilst my stay at Tat's home was brief, it was brilliant. As a design lover I was super pleased with the fitout of my bedroom and shared spaces like the livingroom and dining areas. The space overall was clean and simple with a touch of flair. Tat was warm and welcoming, always happy to have a chat and assist with questions, but respectful of space too. The apartment is in a good spot, close to public transport and with a convenience store and places to eat just a short stroll away. I would highly recommend Tat's home to anyone looking to stay in Surry Hills."
11399407,120352207,2016-12-09,65005001,Irene,"Tat非常友好,精通粵語,普通話,英文,溝通毫無障礙,熱心地給我們講解一些非常實用的景點交通信息。客廳採光很好,裝飾簡潔舒服,廚房可以使用。房間雖然比想像中小一些,但是很乾淨,有自己的洗手間,很棒的住宿體驗!"
11399407,121394515,2016-12-16,102988563,Fanny,"Tat is very nice, helpful and talkative. He gave us a lot of recommendations about playing,travellling,buying etc. His house is very clean and beautiful. We felt very enjoyable and relaxable. Also, 
we were so happy that his room has a separate toilet."
11399407,121766609,2016-12-18,39463827,Mark,Thanks Tat for a great stay.   Enjoyed your place a lot and it was as I found out very convenient for Central so getting about was easy.   Very comfortable room and loved the en-suite facility.    We had some very good conversations and in each of the 3 airbnbs in Australia art has been a big feature of conversations.... Thanks again for being a great host.   kind regards Mark
11399407,122194134,2016-12-21,44350170,Felicia,Tat is an awesome host ! He actually cooked the Chinese tang yuan right at his place to celebrate the festive day together. Fantastic! I stayed at his place twice (loved the first stay) as the place was really convenient to get anywhere and it was really clean and quiet for a great night rest. Can't say more. Highly recommended!
11399407,123139759,2016-12-27,98200731,Yunyan,Excellent
11399407,133342709,2017-02-21,105228433,Bernhard,Exzellente Lage für die Erkundung der Stadt. Sehr sauber und ordentlich. Gerne wieder.
11399407,133628387,2017-02-23,92963709,Youn,Very nice ! He is very kind. And room is really clean and snug!! It was good !!
11399407,134346264,2017-02-26,104605470,Chai Phing,"房東華語可溝通、人很好,房間偏小、乾淨,公用場所優、設計漂亮,地點在住宅區內,走小段路或坐公車到火車站市中心,(SENSITIVE CONTENTS HIDDEN) maps 可以指引妳去任何地方,或吃飯"
11399407,134910912,2017-03-01,104332993,慶德,人很好
11399407,135890285,2017-03-06,90774714,Matt,Tat's place was great. I would recommend it.
11399407,136287694,2017-03-09,25220468,Alan,"Top marks across the board. Tat's home is centrally located with many convenient options to get you to the CBD, beaches, etc. The home is as described and pictured - clean, comfortable, everything you could want. Tat is a fantastic host whom I had the good fortune of getting to know. Highly recommended."
11399407,137506650,2017-03-15,104378738,Ania,"Cosy room, fantastic location, superb host. If you plan to spend time inside, the room might be a bit small for your taste. Travelling with a baby, we were fine-and Tat has a great open kitchen/lounge space. All in all the perfect spot for a few days in Sydney!"
11399407,138076026,2017-03-18,90771938,Catharina,"Tat ist ein sehr sympathischer und freundlicher Gastgeber. Er ist sehr hilfsbereit und hat super Tipps zur Orientierung in Sydney oder zu Ausflügen gegeben. Das Haus von Tat ist großartig, die Ausstattung ist modern und stylisch. Genau wie mein Gästezimmer mit eigenem Bad! Alles ist sehr sauber, hell und geräumig. Das Bett ist sehr bequem, Wifi hat einwandfrei funktioniert. Klimaanlage ist vorhanden, habe ich allerdings nicht benötigt. Ich habe mich bei Tat sehr wohl gefühlt und würde jederzeit wiederkommen."
11399407,138853788,2017-03-21,18271810,Brian,"Quiet but centrally located apartment ideal for couples looking for a home away from home. Extremely clean and excellently ran by tat, who will help you with anything you need. Perfect for surry hills and also close to central station for getting further afield."
11399407,139317809,2017-03-24,114835355,Aamir,"Tat is a great host with a detailed knowledge of Sydney. He helped plan the itinerary and recommended the best restaurants. 

Tat's house is clean, well decorated and comfortable. The ensuite room allows privacy and is extremely neat and clean. 

The area behind Tat's house seems to be low cost housing. But I did not feel unsafe. 

Overall my stay was wonderful."
11399407,140420005,2017-03-29,44698306,Genevieve,Tat was a friendly and accomodating host. Respectful of your privacy but happy to chat! Would definitely stay again anytime :)
11399407,141393371,2017-04-02,1298636,Stefanie,"Tat was an amazing host that left us with good memories of our time in Sydney. He welcomed us warmly the moment we stepped foot into his cosy apartment, of which is really nicely done up and looks just like the pictures. He gave us many great tips about getting around, recommendations of good food around the area etc

The room we got was just nice for 2 and I loved how the shower had a good run of hot water - not those that have slight surges of cold water in between showers. As a female traveler, I was more than happy to see a hairdryer and even make up remover wipes stored in the bathroom.

The neighborhood is quiet with a good mix of cafes and restaurants nearby. Getting around to tourist spots from his apartment is not difficult at all.

Overall, Tat deserves 11/10 stars as a host! I have seen him cleaning the apartment himself so you can expect his place to be absolutely spick and span. Will definitely stay again if I am back in Sydney. Thanks Tat!"
11399407,142994065,2017-04-09,47978651,Heidi,"Tat is the perfect host; welcoming and helpful, he made time to help me navigate around Sydney, and is always happy to chat over a nice cuppa. His house is walking distance to Central, and is in a quiet and safe neighbourhood. His home is spacious and clean, and feels so cosy. The availability of an en suite makes it worth every cent. During my stay, he even made muffins, which he shared with his guests. Next time I visit Sydney, I'll definitely be checking whether Tat's rooms are available first."
11399407,144138678,2017-04-14,116498255,志超,"房东人很好,还帮忙叫车。推荐入住。"
11399407,145948611,2017-04-20,59552441,Pascal,"We had an enjoyable stay at tat's house in Surry Hills. Everything was perfectly clean and the house is really cozy. It's located near central station, so you could easily travel around Sydneys main attractions. Tat takes good care of his guests, it's like staying over at a friends house. Thanks a lot!"
11399407,147090633,2017-04-24,117333732,Katey,"Lovely room, nicely decorated and well thought out. Tat was very helpful and very accommodating. Would definitely recommend."
