listing_id,id,date,reviewer_id,reviewer_name,comments
11399407,148466061,2017-04-30,1604249,Laura & Ivan,"Tat is a fantastic host. When we checked in he gave us a great map which became our bible during our stay. He also gave us great recommendations on restaurants, things to see, places to go etc. He even made banana muffins which he left our on the table for us to enjoy (which were delicious!). We also spent some time sitting and chatting with Tat.. which we very much enjoyed. He is very well travelled and just a world of information! The location of the property is excellent. About a 8 minute walk from central station which will take you anywhere you need to go in Sydney! The room itself was spotless.. The bed was comfortable and there was great wifi. Similarly, the bathroom was extremely clean and modern. We would definitely return to stay with Tat. Many thanks!"
11399407,150437347,2017-05-08,43682964,Jaewon,"지내기에 매우 만족스러웠습니다. 센트럴역과 멀지 않고, 동네도 매우 조용했습니다. 혼자 가거나 둘이 머물기에 딱 적당한 곳입니다."
11399407,152516460,2017-05-16,48295419,天艺,"地理位置很好,Tat的盆友们肥肠热心的招待我和我母亲,觉得很温馨。"
11399407,154971906,2017-05-27,28503637,Su Min,"Located conveniently in Surry Hills with many great cafes, and well connected to Central Station and various bus options. The apartment is beautifully designed and clean. And compliments to the great host, Tat. Hospitable and warm, provided a lot of useful advice to the places to see and dine. Thanks Tat for the lovely stay."
11399407,159374936,2017-06-10,122974381,Steven,"Tat was a fantastic host - very knowledgeable and friendly, while respecting your privacy at the same time.

The room was very tidy and the home was in a great location.

Would defintely stay again!"
11399407,160388614,2017-06-14,72079519,Lin,"I have lived in Tat house second times, Tat is very nice,house is specially clean, and it is much cleaner than other houses I lived .The design of the house is very good and free"
11399407,162235842,2017-06-20,134329048,Ma,"Really nice place and a friendly host, would definitely recommend for others."
11399407,163509393,2017-06-25,16313923,Danny,"Cozy places , Super Green natural house yet super clean and hygiene

Love the cozy living room , Soooo quite in the mid of Vibrant Sydney 

Room + Bathroom attached in sweet way yet super comfie 

Will miss this places and Tat as super host 

Thanks Lot Tat ...."
11399407,168987598,2017-07-11,117560896,Anne,"Tat's house is beautifully presented and spotlessly clean. Check in and out was very easy. It is very well situated near to the CBD, Central Station and plenty of cafes and restaurants."
11399407,171558855,2017-07-18,81206791,Kayan,"Tat是非常好的房东,房间非常舒适,也给我们介绍很多周边的吃喝玩乐"
11399407,173204211,2017-07-23,119374450,Michael,"Tat is a phenomenal host! His place is very clean and extremely well-organized. Beyond that, Tat is very friendly and gave a good overview of all of the tourism destinations and how to get to those places. He was usually around at night, making it easy to ask him questions in person. The bedroom has its own lock, so there's no reason to worry about leaving things there even when there's a guest in the second room. With the private bathroom attached the bedroom, staying here is as comfortable as living at home. Highly recommend!"
11399407,215809396,2017-12-01,95205529,Hee Peng,"great hospitality, the moment i checked in, he showed me all the locations of public transports and attraction spots"
11399407,216668845,2017-12-04,97387516,민례,I love this house. Its very clean and cozy. And host is so kind.
11399407,217572803,2017-12-09,10965393,Zjia Fernn,"The place is exactly as pictured in the airbnb site - bright, clean, tastefully renovated and located at a convenient location (5 mins walk to the bus stop and convenience store). Furthermore, Tat is a nice and thoughtful host that makes sure his guests have a pleasant stay."
11399407,218450460,2017-12-12,157172547,Irina,"Tat is a wonderful host, very attentive to detail and ready to help out. His place is wonderfully cozy, new and has everything you might need. It is a bit of a walk from the Circular Quay, which is the touristic centre of Sydney, but you can always catch a bus or a taxi if you need a ride. I personally got to know Sydney much better thanks to the walk I had to take from Tat’s place to the Circular Quay.

Тат - замечательный хозяин, очень внимательный к деталям и готовый помочь. Его дом очень уютный, со свежим ремонтом, и в нем есть все необходимое. Дом расположен далековато от Circular Quay, туристического центра и главного причала паромов Сиднея, но если Вы не готовы идти пешком, всегда можно доехать на автобусе или такси. Лично мне прогулки до центра подарили отличную возможность лучше познакомиться с городом и увидеть все значимые достопримечательности по пути."
11399407,219159900,2017-12-16,115655963,창근,"It was perfact place where I ever been visited !
I recommend you this house guys !
Thank you Tat!"
11399407,225251967,2018-01-05,73489703,Angel,"Tat is a wonderful host and very attentive. He is quick to respond, and he is always open for a chat. The room was wonderful and very clean. Thank you so much Tat!"
11399407,225915983,2018-01-08,46375282,Jimena,"Tat´s place is amazing, the decoration of it´s house is great, the room is super comfortable and everything is clean. Walking distance to city and crown street. Would love to come back!!"
20934541,198259259,2017-09-28,57592702,Mitesh,"Amazing location, value for money. Great hosts."
20934541,202112835,2017-10-10,3012582,Jamaal,"The location was prime walking distance to everything I needed. The apartment was clean, cozy and perfect for my holiday. The response with the host was fast, easy and no trouble whatsoever. I was expecting for there to be a lot of noise but it was fairly quiet at night and rowdy during the day. I would definitely stay here again."
20934541,203301239,2017-10-14,77791515,Millie,"Great apartment in the perfect Sydney location, especially if you're using public transport. Really clean, spacious & the host was really helpful"
20934541,205318293,2017-10-22,24674060,Patrick,"Super comfortable, thanks for hosting."
20934541,208735235,2017-11-03,7922083,Kathrin,Perfect Place to explore the city by foot. Cool and stylish neighbourhood. Walking distance to Main Station. Easy check in and out. Helpful contact with host. Nice spot in the heart of the City
20934541,213566220,2017-11-21,152133469,Alex,Great apartment. Surry Hills is a fantastic area and I could totally see myself living in the apartment full time! Highly recommend.
20934541,224674245,2018-01-03,120720576,Thomas,Great location. Great host. Make sure to add a fan in bedroom
15719888,124415753,2017-01-01,10000032,Gaurav,Bronwyn met us at the time mutually agreed to show us around the house. she was really friendly. We were emailed a house manual which had details one would require. The neighbourhood was quiet and we enjoyed the proximity to city and the convenience to coffee shops and bars. Would definitely recommend this place to our friends.
9827619,93411906,2016-08-12,12983334,Linda,"This is our 3rd stay with Mary.  Mary is the most gracious host, she is kind and the most considerate host you can expect. We love staying at her home which is home away from home for us.  It is convenient to our family and friends and great shopping centres.  Over the years we have even became quite aquainted with the lovely neighbours who are also the nicest of people.  On
this occassion we had the front 2bedroom house which was perfect for my growing girls who need their own space.  Having the extra space and full kitchen was great and I even managed to bake on a few occassions.  Look forward to returning to Mary's cosy home on our next annual visit.  Thank you Mary"
9827619,96450089,2016-08-22,64850573,Osama,Perfect hospitality accurate description and nice neighborhood
9827619,97498109,2016-08-27,67131586,Justin,Excellent host
9827619,98932408,2016-09-02,18897114,Jerry,"Mary有一个精致美丽的小花园(当初选择这里就是因为那张门前的美照),这栋有百年历史的房子也很舒适。房东老太太很热情,听说我们带了孩子,就问孩子男孩女孩和几岁,给小朋友专门准备了几箱子玩具。我们到的那天,她还专程驾车带着我们在周围转转,熟悉最近的购物中心,公交车站,火车站,加油站甚至办公交卡的地方。厨房里,她还为我们准备了健康的全麦多果仁面包和牛奶,做饭用的黄油橄榄油盐和胡椒等各种材料和工具都很齐全,非常贴心。如果有机会再到悉尼,还会选择住Mary的美屋!"
9827619,102331479,2016-09-17,84593014,Kim,"""Cosy Cottage"" was the perfect fit for me for my 2 week stay.  Everything Mary had detailed was accurate and the area really is as quiet as stated.  Mary's contact was very prompt and during my stay was respectful and considered, checking that everything was ok.  I arrived late at night (Mary even recommended trains etc) and was waiting for me to explain the amenities, including a much appreciated breakfast for my early start the following morning!  I would highly recommend ""Cosy Cottage"" if you are looking for a home away from home."
9827619,104781980,2016-09-28,7840330,Damiano Vesentini,"Communication with Mary was great and she was very considerate of me and my children. The cottage is very homey and the location perfect for my needs. Will be back in one week for the last part of my trip, but definitely again in future trips to Sydney.
"
9827619,106200583,2016-10-04,59837058,Cc,"房子特别舒适,适合家庭短期旅行,我们一行5人在MARY的房子住的特别开心,房子前院小花园很漂亮,后院房东让我们晒衣服,房东是很和蔼的老太太。下次有机会去悉尼还会选择MARY的房子。"
9827619,107927629,2016-10-13,7840330,Damiano Vesentini,"This was my second time staying at Mary's cottage and it felt really like home. I just look forward to my next visit! My children also loved it there and have been asking Mary a lot of questions, which she was patient enough to answer. Overall, a great stay!
"
9827619,108678188,2016-10-16,16924752,Paul,"Thanks Mary, the place was as described and easy to access. We had a wedding nearby over the weekend so we really enjoyed the convenience of the place. Leaving us some bread, tea and milk were a nice little touch that was appreciated."
9827619,110667876,2016-10-27,72409738,Luisa,We like Mary quickly reply to our queries. Mary's place has wifi access .
9827619,117112670,2016-12-04,101111648,Wendy,"Mary was friendly and welcoming and then slipped off of the scene to give us privacy. When I needed some local advice, it took just one phone call and she was able to help. 
The place was clean and well equiped.
Mary was keen to have suggestions as to how to improve the listing further.
Quiet area close to shops and public transport."
9827619,121924671,2016-12-19,106095271,Ihab,"Our stay at Mary's was absolute pain relief after 24 hours flight from overseas. The fridge was filled with fruits, bread, jam and milk, that was really generous from her. And when she knew that we were trying to find a longer stay accommodation, she guided us through lot's of where-abouts. She really made us feels we are welcomed, and we do believe we earned her as our first friend in Sydney. The Airbnb described this home as a rare find, and sure it is. The house is furnished from a - z, clean, comfortable. Suitable for small family, you will find nice toys for your kidz to play with.

The location is really near from 2 different lines of transportation, one towards Macquaire area and the other towards down town. Train stations also not that far if you intend to reach far districts. Buses should take 5 mins to Top Ryde and Macquaire shopping centers. Midway Shopping center is 5 mins walking from the door. The neighborhood is really quite..



"
9827619,122322718,2016-12-22,49899805,David,Mary was a lovely host who introduced herself to give us the lay of the land then gave us our privacy. The cottage is very comfortable and homely (there were even basics in the fridge etc.) and the street very quite. We enjoyed our stay and were especially appreciative of her taking time to show us toys she had for my daughter. Highly recommended.
9827619,122744564,2016-12-25,27758844,榆凱,"The house is so excellent, strong home feeling and so comfortable."
9827619,143445307,2017-04-11,29885518,Chris,"Mary was a fantastic host and was very easy to communicate with before and during our stay. She had been very clear that the house is in a quiet area which we really liked. We found we were also able to easily park a car outside and the location allowed us to explore Lane Cove National Park and the Northern beaches which was ideal. 
We found the house to be equipped with everything we needed and were very comfortable. The house is very cosy and homely; we'd love to stay again!"
9827619,146842009,2017-04-23,7840330,Damiano Vesentini,"It was very nice to come back to Mary's house for the third time. Great place, quiet and comfortable. My kids love the place and asking Mary a million questions, which she patiently replies. Will definitely be back again to my home away from home!"
9827619,156740153,2017-05-31,110415744,Marlis,"We had a lovely, great stay at Mary's house, fully recommend staying there! The house was so well equipped and cozy, we really felt at home. Mary is a wonderful host, easy to communicate with and very helpful! Full privacy is given, too. We are 100% satisfied and enjoyed our stay to the fullest!"
9827619,179562787,2017-08-07,12983334,Linda,This is our fourth stay at Mary's and have already rebooked for next year.  Mary is the most gracious and considerate host you can ever meet.  Our stays are always warm and enjoyable.  We really feel it's our home away from home.
9827619,188864405,2017-08-31,56536068,Carlos Eduardo,"Trata-se de um espaço acolhedor, aconchegante, disponibilizando tudo o que se faz necessário com muito conforto. Espaços confortáveis e completos."
9827619,191260978,2017-09-06,89725404,Amey,Simply the best host and the house. Worth every penny. The house is extremely spacious. The neighbourhood is very quiet. You can live here forever
9827619,196674509,2017-09-24,26984055,Sandy,"We have lived in Mary's house for 16 days and strongly recommend this place. It locates in a quiet street and is convenient for shopping and public transport. Mary is very nice and considerate. She prepared a detailed guidebook for guests as well as a lot of life necessities in case they forgot to take or need temporarily. In summary, it is awesome experience of living there not only for tourists but also for new immigrants."
9827619,201731899,2017-10-08,7840330,Damiano Vesentini,Always nice to stay at Mary's house... This is my fourth visit and it was as comfortable as I remembered! Will have to come back again. The location is great and the house is very quiet and welcoming. Communication with Mary was punctual and precise. Great host!
9827619,203336120,2017-10-15,152261129,Emma,"It felt like we were at home, would definitely stay again!"
9827619,205294382,2017-10-21,54567378,Yvonne,"Mary’s cottage was well equiped and very comfortable. It is situated in a quite street with ample parking. Mary met us on arrival and helped us to settle in. She then retired to her section of the house and left us to enjoy our stay. However, she was always available to help us if we required further information about transport and the local area. A very pleasant stay. I would highly recommend this property."
9827619,210169414,2017-11-08,70403545,Fei,good location and very friendly
9827619,212212318,2017-11-16,119330662,Glen,This was our first stay at an Airbnb and we were pleasantly surprised on how nice it was.  We will definitely book Airbnb in the future because of our experience with our stay at Mary’s.
9827619,214903757,2017-11-26,82779847,성웅,"everything is perfect. ex} kitchen.yard.host's kindness.etc..
it takes 8min by bus from eastwood. especilly the house is very peaceful and it makes feel very happy.
I want to get 5 stars more.^^"
9827619,216974152,2017-12-07,154540192,Tatsuki,"Perfect!!
Mary’s house was very good location.
It was very clean and relaxing place.
Mary is very friendly and kind.
We spent the best time in her house.
We never forget this trip.
That became a wonderful memory thanks to her.
We wanna stay her house again.
Thank you so much."
9827619,220309868,2017-12-21,120307638,Sheila,A very pleasant stay.
9827619,222447301,2017-12-29,144996689,Youngsook,동네가 아주 조용하고 깨끗했어요.아이들방도 아주 아늑하니 잠자기에도 아이들이 참으로 좋았고 주방도 활용도가 좋아ㅛ어요
9827619,225241181,2018-01-05,129287798,Angela,"Great location, clean and comfortable. Mary is a lovely host and is a good source for local information, but does not interfere with your stay unless you need anything.  Would recommend for anyone."
22235812,223863802,2018-01-02,40806999,Alejandro,Great and very cosy. Sakura was kind and nice.
8957151,57537056,2015-12-27,48426149,Nancy,"An absolutely beautiful, clean and calm Apartment with an amazing view directly to the sea. The apartment is even more beautiful as we expected. 10 minute walk to a wonderful Beach. Absolutely perfect for spending calm and relaxing days!"
8957151,58013010,2015-12-31,47293477,Matteo,"Spent 3 days at Agnes's Nest, overall location was great, view from the balcony was super. Apartment conditions were good. Agnes was very friendly and responsive."
8957151,68713926,2016-04-06,25731490,Paul,"Although our host, Agnes, was overseas whilst we stayed her apartment, she emailed many times before and gave us two contacts for our stay. Both of which were very helpful, and made us most welcome.
The apartment is superb, and the area is in a beautiful location of Sydney.
Great public transport, 7 minutes from the apartment."
8957151,70776296,2016-04-20,66116715,Steve,"The property is very modern and in a fantastic location.  All the essentials were provided and my Schnoodle Astro was made equally welcome.

Sleeping with the sound of the ocean rolling on on the nearby beach is one of the great aspect of this home.

Thanks for providing a great location

Steve"
8957151,71327189,2016-04-24,49222446,Michael,"Wow, what a gem!  Raven's Nest is simply a piece of heaven.  Greeted promptly and with a smile, this apartment has everything you need for a quite and secluded getaway.  When back in Sydney, I will definitely be visiting the next again."
8957151,73892494,2016-05-11,64598939,Ozgur,Agnes is great host and provide great apt for visitors in so silent and peaceful enviroment. Hope to come back and stay again. I do thank Agnes again.
8957151,75591742,2016-05-22,31201604,Julia,"This place is one of the nicest spots I have ever stayed in through Air B n B. Firstly, we were warmly greeted by a friend of Agnes at the beginning of our stay who provided the keys and gave us the grand tour of the apartment. A really lovely feature of this place is that it is an old hospital. The suburb itself has some rich history which we found interesting to explore.
Once greeted, we were take away by the view. We didn't see any whales but I'm told they do swim past at this time of year. 
We found the apartment clean and homely. Agnes is a lovely artist and the place was furnished and decorated beautifully.
If you do stay here, a car would be preferable. We found it easy to access the airport, city and surrounding beaches with our car and the on-street parking was very easy - there were always plenty of spots for us to park.
Agnes was very kind with letting us check out late which was greatly appreciated. 
This is a spot that doesn't feel like you are in Sydney! It is truly a holiday retreat. Highly recommended, would stay again in a heartbeat."
8957151,78247573,2016-06-06,73832673,Paige,"Beautifully decorated, tidy apartment with an amazing view. The birds nest was amazing,although the weather was terrible I couldn't have been happier staying here. Very friendly and accommodating thank you Agnes!"
8957151,79729454,2016-06-13,9197268,Cate,"Agnes was very helpful and informative. Her friend was able to fit in with my time frame to collect the key, and showed me around the apartment. I felt welome and at home, with tea and coffee available and pantry items also (use/replace, perfect). The apartment is beautifully furnished and the view is wonderful."
8957151,96630670,2016-08-23,53915575,Alistair,Agnes was herself on holiday when we arrived but she had organised a great welcome from Garry who acted on her behalf.  The Nest is just a wonderful place and indeed Little Bay is a fantastic setting.  The facilities and of course the view from the apartment are first class.  We especially loved having breakfast on the balcony whist watching the whales swim by.  There are great places to eat nearby and if you are a golfer then you have 4 courses to choose from on your doorstep.  Highly recommended as a home from home and place to stay.  Many thanks to Agnes (and Garry)
8957151,97852197,2016-08-28,84037083,Melita,It was amazing. I loved the nest with spectacular views.
8957151,100221162,2016-09-08,40107094,Anusha,"Our stay at the nest was a relaxing and great experience. The house is clean, inviting and extremely comfortable. We were even lucky enough to see a few whales from the balcony! Agnes and her friends were extremely attentive and flexible when we were checking in. The area of little bay was beautiful and calm; a great change from the hustle and bustle of the city. Thank you so much for allowing us to stay at your beautiful place Agnes."
8957151,101096585,2016-09-11,58647460,Jennifer,This apartment was stunning! Loved the view and attention to detail in the interior decoration. Also a great location with close proximity to a little beach and golf clubs. More character than your average hotel room!
8957151,105394278,2016-10-01,43008796,Jieshu,"Agnes's nest is excellent and so beautiful. And we didn't meet Agnes but her friend Gary gave us great advices when we arrived. My mom love Agnes's apartment so much. We can see the sea and golf club every morning, these makes my mom feel really relax. Everything is so great. I can't find any places that I'm not satisfied!!! I would highly recommend her apartment and next time my mom came to Sydney, I would like to book Agnes's nest again:)"
8957151,125093713,2017-01-03,66865378,Pacecar1986,"Der Hammer ! Tolles Apartment und eine tolle Lage. Sehr ruhig mit einem schönen Blick auf das Meer. Alles war so wie auf den Bildern und Agnes hat sich liebevoll um uns gekümmert. Wenn wir wieder nach Sydney kommen, werden wir auf alle Fälle zu Ihr gehen."
8957151,126063408,2017-01-08,19642442,Nelke,"As well travelled country dwellers seriously if you want a home away from home yet in the city, if you want to relax & watch the ocean across the nsw golf course, if you cycle swim, run or are active in any way this is the perfect place! 
We can't speak more highly of Agnes or her home."
8957151,127072967,2017-01-15,64006656,Bridget,"The nest lived up to its expectations. The views are amazing and it is in an ideal spot. Quiet, friendly area that is close and in walking distance to cafes and the beach. Easy parking and lots of greenery, parks and places to explore. Thanks Agnes for your place !"
8957151,127754716,2017-01-20,3639183,Dee,"Agnes' place is amazing! We stayed for two nights and wish it could have been longer. It is really close to the beach, only about a 10 minute walk, and driving distance to shops. Agnes made it really easy to check in and we felt very looked after. Great communication and a beautiful place to stay. Can't wait to come back again!"
8957151,128970671,2017-01-28,20046073,Sandie,"Secluded, but close to public transport (one bus to town), great local restaurants a short walk away, bush and beach  nearby for a walk or swim, a friendly host, and wow what a view."
8957151,130842998,2017-02-08,7653113,Lars,Absolutely awesome!
8957151,133339408,2017-02-21,28522798,Lesley,Beautiful and relaxing time in Agnes's Unit.  The view was fabulous.  Great to meet Agnes.
8957151,133473150,2017-02-22,2433373,Brittany & Josh,The host canceled this reservation 16 days before arrival. This is an automated posting.
8957151,133992104,2017-02-25,114284385,Fiona,"Agnes has been an amazing and exceptional host!!  We were there for a weekend. Not only was she there to welcome us on the arrival and shown us everything that we need to know, she is also a host  with a lot of love and care. My dog has heart problems  that needs medication so we need to bring him with us on the trip, and Agnes allowed him to stay. He had a really great time!  The location is amazing and the apartment is very stylish and has a beautiful seaview.  Everything is very clean and well organised. It makes our stay an awesome experience!!  I highly recommend it!! 

We will definitely be back when we visit Sydney next time!! Thanks again Agnes!!"
